"Galerstein, Nina.",Age Appropriate Activities for Adults with Profound Mental Retardation.,N/A ,N/A,"Cover; Title Page; Copyright; Acknowledgements; Contents; Introduction; Background, Clientele, Audience, Application; Definitions of the Therapies; Interdisciplinary Collaboration; Part One: Population, Programs, and Communication; Chapter 1: Population Descriptors; Physical/Motor; Sensory; Communication; Chapter 2: Structuring Programs and Activities; Creating a Group, ; Working with Individuals in Groups (Processes); Group Structure and Activities; Psychological Issues; Chapter 3: Considerations for Functional Communication; Communication, Language and Speech; Communicative Competence.;Verbal Versus Nonverbal CommunicationMarkers for Nonverbal Communication; The Communication Dictionary; Part Two: The Scenarios; Chapter 4: Introduction, Important Considerations; Introduction; Important Considerations; Chapter 5: Activities of Daily Living; 1.{euro}{euro}Music Assisted Personal Grooming; 2.{euro}{euro}Skin Care; 3.{euro}{euro}Hair Care; 4.{euro}{euro}Pre-Dressing Skills; 5.{euro}{euro}Adaptive Fastener Frames; 6.{euro}{euro}Meal Preparation; 7.{euro}{euro}Beverage Preparation; 8.{euro}{euro}Homemaking; 9.{euro}{euro}Using Switches; Chapter 6: Sensory Stimulation; 1. Aromas; 2. Nature Box; 3. Dark Box/Column; 4. Find the Musical Sound; 5. Find the Sound.;6. Music-Playing Rhythm Instruments7. Music and Tactile Defensiveness; 8. Vibration; 9. Texture Rub; 10. Brushing; 11. Deep Massage; 12. Water Exploration; 13. Sponges; 14. Walking; Chapter 7: Gross Motor; 1. Shoulder Arc; 2. Movement With Ribbon Sticks and Scarves; 3. Play the Xylophone -- 4. Hokey Pokey; 5. Dance/Movement With Chinese Jumprope; 6. Therapy Balls; 7. Beanbag Basketball -- 8. Obstacle Course; Chapter 8: Fine Motor; 1. Therapeutic Putty; 2. Sand Box; 3. Manipulation Box; 4. Egg Shaker Chant; 5. Magnets; 6. Peg-Board; 7. Bright Builders; 8. Containers; 9. Lock Board.;10. Collages11. Stamp Collection; 12. Flower Arranging; 13. Pre-writing; Chapter 9: Cognitive; 1. Environmental Sounds Tape; 2. Imitation; 3. Body Part Identification; 4. Music and Movment If You're Happy and You Know It -- 5. Common Object Identification; 6. Find the Object; 7. Making Choices; 8. Memory Book; 9. Puzzles; Chapter 10: Communication; 1. Story/Current Event Retelling; 2. Taking Turns (Throwing a Ball); 3. Table Top Turn-Taking; 4. Making Requests (Utilizing a Switch); 5. Adapted Yes/No Response; Chapter 11: Social/Recreation; 1. Balloons and Music; 2. Parachute.;3. Shake Hands """"Hello""""4. Play the Drum; 5. Tape/CD Player and Switch; 6. Active Television Watching; 7. Board Games; 8. Plant Care; 9. Pet Care; Part Three: Materials and Resources; Scenario Specific Materials including catalogs and books; Bibliography & Recommended Reading; About the Authors.",People with mental disabilities;Intellectual disability;Intellectual disability;People with mental disabilities
"Gaschnitz, K. Michael.",Statistical encyclopedia of North American professional sports :,"all major league teams and major non-team events year by year, 1876 through 2006 /",N/A,Statistical Encyclopedia of North American Professional Sports; Table of Contents; Introduction to the First Edition; Introduction to the Second Edition; Awards; American Basketball Association; Canadian Football League; Major League Baseball; Major League Soccer; National Basketball Association; National Football League; National Hockey League; North American Soccer League; Women's National Basketball Association; World Hockey Association; List of Abbreviations; Year-by-Year Sports Statistics; 1876; 1877; 1878; 1879; 1880; 1881; 1882; 1883; 1884.;18851886; 1887; 1888; 1889; 1890; 1891; 1892; 1893; 1894; 1895; 1896; 1897; 1898; 1899; 1900; 1901; 1902; 1903; 1904; 1905; 1906; 1907; 1908; 1909; 1910; 1911; 1912; 1913; 1914; 1915; 1916; 1917; 1918; 1919; 1920; 1921; 1922; 1923; 1924; 1925; 1926; 1927; 1928; 1929; 1930; 1931; 1932; 1933; 1934; 1935; 1936; 1937; 1938; 1939; 1940; 1941; 1942; 1943; 1944; 1945; 1946; 1947; 1948; 1949; 1950; 1951; 1952; 1953; 1954; 1955; 1956; 1957; 1958; 1959; 1960; 1961; 1962; 1963; 1964; 1965; Volume Two; Year-by-Year Sports Statistics; 1966; 1967; 1968; 1969; 1970; 1971; 1972; 1973; 1974; 1975; 1976; 1977.;19781979; 1980; 1981; 1982; 1983; 1984; 1985; 1986; 1987; 1988; 1989; 1990; 1991; 1992; 1993; Volume Three; Year-by-Year Sports Statistics; 1994; 1995; 1996; 1997; 1998; 1999; 2000; 2001; 2002; 2003; 2004; 2005; 2006; Individual Team Statistics; Volume Four; Individual Team Statistics; Appendix A: Team Nicknames; Appendix B: Stanley Cup Winners 1893-1907; Appendix C: Grey Cup Winners Prior to 1950; Bibliography.,Professional sports;Sports;GAMES;SPORTS & RECREATION;SPORTS & RECREATION;SPORTS & RECREATION;SPORTS & RECREATION;TRAVEL;Professional sports.;Sports.
"George, Nelson.",Elevating the game :,Black men and basketball /,N/A,N/A,Basketball;African American athletes;African American athletes.;Basketball.;Basketball;Black athletes
"Gilbert, Marc-Andre,","An organizational approach to the study of productivity, efficiency, and satisfaction of AAA high-school basketball teams :",based on Fiedler's contingency model and Taylor and Bowers' survey of organizational conditions /,"Vita.;""UO-78 32--UO-78 34.""",N/A,Basketball;Leadership.;Petits groupes.;Sports;Basketball;Leadership.
"Goldberg, Jeff.",Unrivaled :,"UConn, Tennessee, and the twelve years that transcended women's basketball /",N/A,For the good of the game -- 1984-94: birth of the dynasties -- 1995: dog day afternoon -- 1996: semi-tough -- 1997: an imperfect Tenn -- 1998-99: boo yeah -- 2000: ready for prime time players -- 2001: everybody hurts -- 2002: hitting something orange -- 2003: the evil empire -- 2004: end of an era -- 2005-7: Moore trouble ahead -- 2007-13: unrivaled.,Women basketball players;Sports rivalries;Basketball for women;College sports;SPORTS & RECREATION;Basketball.;Basketball for women.;College sports.;Sports rivalries.;Women basketball players.
"Gorn, Elliott J.,",A brief history of American sports /,N/A ,N/A,"Part I: America becomes a sporting nation -- Colonists at play -- ""Saints and their bodies"": Sport through 1860 -- ""Vigorous, manly, out-of-door sports"": The gilded age -- Part II: Sport and its discontents: The twentieth century -- Sports with a mission: Football and basketball -- Play, business, and space: Sports and the public sphere -- Money, television, drugs, and the win: Dilemmas of modern sports.",Sports;Sports;Sports.;Sports - {acute}Etats-Unis - Histoire.
"Graham-Felsen, Sam,",Green :,a novel /,N/A,N/A,Interracial friendship;Middle school boys;FICTION;FICTION;FICTION;Interracial friendship.;Middle school boys.
"Gray, Gary Robert,",The relationship between elements of team cohesiveness and team success at various levels of basketball competition /,N/A ,"Vita.;""UO-77 73--UO-77 74.""",N/A,Basketball;Interpersonal relations.;Teamwork (Sports);Petits groupes;Relations humaines.;Sports;Basket-ball.;Basketball;Interpersonal relations.;Teamwork (Sports)
"Griffin, Norma Sue,",A comparison of the heart rates of female college participants in field hockey and basketball /,N/A ,"""UO-69 548--UO-69 551.""",N/A,Sports for women;Heart beat.;Heart beat.;Sports for women
"Guffey, Greg.",The golden age of Indiana high school basketball /,N/A ,N/A,"Title Page ; Copyright Page ; Table of Contents; Acknowledgments; Introduction; 1 The Beginning: ""It was every player's dream to be on the varsity team. That's all we thought about.""; 2 ""You just forget everything and play by instinct.""; 3 ""If you weren't at the ballgame, you were either dead or sick.""; 4 ""It was a knock-down, drag-out affair each time we played.""; 5 ""Being a senior, it was like the world had come to an end.""; 6 ""We're an old river town with a lot of pride.""; 7 ""You fought like crazy against them, but you were friends when it was over."";8 ""The idea one guy can't get you there is wrong.""9 ""Once we got past Muncie, I thought we could beat the world.""; 10 ""The sectional was the big thing. That was what gave you the bragging rights.""; 11 ""Very few small towns ... are known like this small town.""; 12 ""Oscar made the difference.""; 13 ""We didn't beat them with a bunch of ham-and-eggers.""; 14 ""I hear you are a pretty good player. If you've got anything, I'll get it out of you.""; 15 ""He looked like a toothpick, but he could shoot.""; Epilogue; APPENDIX: IHSAA STATE CHAMPIONSHIP TOURNAMENT BRACKETS, SWEET SIXTEEN, 1945-1959.",Basketball;School sports;GAMES;SPORTS & RECREATION;SPORTS & RECREATION;SPORTS & RECREATION;SPORTS & RECREATION;TRAVEL;HISTORY;Basketball.;School sports.
"Hall, Donald,",Fathers playing catch with sons :,"essays on sport, mostly baseball /",N/A,N/A,Sports;Baseball;Sports.;Baseball.;Sports.;Baseball.;Sports.;Sport;Belletristische Darstellung;Baseball
"Happ, Carol K.",Hardiness levels and coping strategies of female head women basketball coaches in the National Collegiate Athletic Association /,N/A ,N/A,N/A,Women coaches (Athletics);Basketball coaches;Toughness (Personality trait);Stress (Psychology);Basketball coaches;Stress (Psychology);Toughness (Personality trait)
"Harris, Sarah Ballinger.",A coaching self model :,experiences of self among college basketball coaches /,Title from PDF title page screen.;Advisor: Diane L. Gill ; submitted to the School of Health and Human Performance.,N/A,Basketball coaches;Self-perception.;Basketball coaches;Self-perception.
"Hastings, Penny.",Sports for her :,a reference guide for teenage girls /,N/A,N/A,Sports for women;School sports;Sports for women.;School sports.;Sports for women.;Sports for women.;School sports.
"Hawken, Kieren.",The a-Z of NES Games,N/A ,N/A,"Cover; Front Matter; Title Page; Publisher Information; Introduction; Games; A; Arkanoid; Alien Syndrome; Arch Rivals; B; Bad Dudes Vs. Dragon Ninja; Bill & Ted's Excellent Adventure; Boulder Dash; C; Caesar's Palace; City Connection; Cyberball; D; Donkey Kong Junior; Defender of the Crown; Double Dragon II: The Revenge; E; Elite; E.T. The Extra Terrestrial; Eliminator Boat Duel; F; F-15 Strike Eagle; Fester's Quest; Friday 13th; G; Ghosts 'n' Goblins; Gauntlet; Ghostbusters; H; Hatris; Hard Drivin'; Hudson Hawk; I; Indiana Jones and the Temple of Doom; Image Fight;Ivan ""Iron Man"" Stewart's Super Off RoadJ; Jimmy Connors' Tennis; Jackal; Jack Nicklaus Championship Golf; K; Kick Off; Karnov; Karate Champ; L; Legend of Kage (The); Lode Runner; Last Starfighter (The); M; Millipede; Mighty Bomb Jack; Ms. Pac-Man; N; Ninja Gaiden II: The Dark Sword of Chaos; Nintendo World Cup; North & South; O; Orb 3D; Over Horizon; Overlord; P; Paperboy; Pac-Land; Puzznic; Q; Q*bert; Quattro Adventure; Q Boy; R; Rainbow Islands; Road Blasters; Rolling Thunder; S; Smash T.V.; Star Soldier; Side Pocket; T; Toobin'; Teenage Mutant Ninja Turtles; Toki; U; Ultimate Air Combat;Uncanny X-Men (The)Ultimate Basketball; V; Victory Road; Vegas Dream; Venice Beach Volleyball; W; Wheel of Fortune; WWF Wrestlemania Challenge; World Games; X; Xexys; Xmas 8-bit 2016; Xpedition; Y; Yousei Monogatari Rod-Land; Yoshi's Cookie; Yo! Noid; Z; Zombie Nation; Zoda's Revenge: Star Tropics II; Zen the Intergalactic Ninja; Back Matter; Also Available",N/A
"Heilman, Laurel L.",Factors influencing college selection by female basketball players participating in the Pennsylvania State Athletic Conference /,N/A ,"""UO 89 296.""",N/A,College choice;Women basketball players;Women college students;Decision making.;Prise de d{acute}ecision.;Universit{acute}es;Joueuses de basket-ball;{acute}Etudiantes;College choice.;Decision making.;Women basketball players.;Women college students.
"Hess, Alan,",Photographing indoor sports :,"the right settings, gear, and tips for shooting basketball, martial arts, and other low-light sports /",N/A,N/A,"Photography of sports.;Photography of sports.;Visual Arts.;Art, Architecture & Applied Arts.;Photography."
"Hirsch, Sheldon,","Hot hands, draft hype, and DiMaggio's streak :",debunking America's favorite sports myths /,N/A,N/A,Sports;GAMES;SPORTS & RECREATION;SPORTS & RECREATION;SPORTS & RECREATION;SPORTS & RECREATION;TRAVEL;Sports.
"Hoffman, Jeffery D.",Sport-confidence and perceptions of coaching behavior of male and female high school basketball players /,N/A ,N/A,"Abstract: Determining the levels of confidence athletes possess, as well as the way in which athletes perceive the behaviors of their coach, are issues in sport. The participants in this study included male (n. = 39) and female (n. = 42) high school basketball players. The student-athletes were asked to voluntarily respond to the Trait Sport-Confidence Inventory (TSCI; Vealey, 1986), State Sport-Confidence Inventory (SSCI; Vealey, 1986), and the Coaching Behavior Questionnaire (CBQ; Kenow & Williams, 1992) . The negative relationship between perceptions of coaching behavior and trait and state sport-confidence was significantly (p <.05) less than zero. In addition, the mean trait and state sport-confidence scores of males were significantly (p <.05) higher than the mean trait and state sport-confidence scores of females; however, the mean perceptions of coaching behaviors was not significantly (p> .05) different for males and females. Finally, no significant (p> .05) interaction was found between competitive setting and gender of the participants with respect to perceptions of coaching behavior. Male and female high school basketball players tend to experience higher levels of confidence when they perceive their coach as displaying positive coaching behaviors; however, males tend to possess higher levels of confidence than females.",High school athletes;Basketball players;Coaching (Athletics);Self-confidence.;Coach-athlete relationships;Basketball players;Coaching (Athletics);High school athletes;Self-confidence.
"Hoose, Phillip M.,","Hoosiers, Third Edition :",the Fabulous Basketball Life of Indiana.,"16 Passages: What Has Become of Selected People, Places, and Buildings of Hoosier Hysteria Index.","Cover; HOOSIERS; Title; Copyright; CONTENTS; Foreword ; Acknowledgments ; Introduction ; 1 Farm Boys: How Indiana Became the Basketball State ; 2 Milan High School: The Hoosier Dream ; 3 Indianapolis Crispus Attucks High: The Black and White of Hoosier Hysteria ; 4 Anderson, Indiana: Basketball Town.;5 The Calumet Region: Hoops in the Other Indiana 6 Judi Warren and the Warsaw Tigers: Into the Front Court ; 7 Fathers and Sons: The Mounts of Lebanon, Indiana ; 8 Meadowood Park: Speedway, Indiana ; 9 Larry Bird: The Guy Down the Road ; 10 The Education of Stephanie White.;11 Coaches: From the Lady Lions to Bob Knight 12 Steve Alford: All In ; 13 An Interview with Damon Bailey ; 14 Four-Class Basketball: Death or Salvation of Hoosier Hysteria? ; 15 Perspective: Four Things that Remain Distinctive about Indiana's Game.",Basketball;Basketball players;GAMES;SPORTS & RECREATION;SPORTS & RECREATION;SPORTS & RECREATION;SPORTS & RECREATION;TRAVEL;SPORTS & RECREATION;Basketball.;Basketball players.
"Howard-Cooper, Scott,",The Bruin 100 :,the greatest games in the history of UCLA basketball /,N/A,N/A,Basketball.
"Huizenga, Kevin,",Gloriana :,Glenn Ganges comics /,"""Orig. publ. 2001"".",The groceries -- The sunset -- The moon rose -- Basketball.,"Married men;Man-woman relationships;Social interaction;Conduct of life;Comic books, strips, etc.;Graphic novels.;Social interaction.;Married men.;Man-woman relationships.;Graphic novels.;Conduct of life.;Comic books, strips, etc."
"Ianni, Anthony,",Centered :,"autism, basketball, and one athlete's dreams /",N/A,"Foreword by Tom Izzo -- Acknowledgments -- Prologue : the banks of the Red Cedar -- ""Do those impressions"" -- ""We want to tell you a story"" -- AAU -- #44 -- Family -- Instant classic -- Still autistic -- Committed -- On campus -- The streak -- Sophomore slump -- Release -- Getting back up -- Sitting out -- The jersey -- ""I'm screwed up"" -- The Carl Vinson and the garden -- The big ten -- Tournaments and awards -- Commencing.",Basketball players;Autistic athletes;College students with disabilities;Autistic athletes.;Basketball players.;College students with disabilities.;BIOGRAPHY & AUTOBIOGRAPHY / Sports
"Isaacs, Neil D.,",You bet your life :,the burdens of gambling /,N/A,Seven other myths about gambling -- Gambling and the irrational -- The high-profile profile -- The compulsion to lose -- Gambling and anxiety -- Gambling and depression -- Gambling and psychosis -- Filling the void -- Gambling and the brothers barthelme -- Gambling and the personality disorders -- Gambling and addiction.,"Compulsive gambling.;Gambling;Behavior, Addictive;Disruptive, Impulse Control, and Conduct Disorders;Jeux de hasard;PSYCHOLOGY;Compulsive gambling."
"Jenkins, Dan.","You call it sports, but I say it's a jungle out there /",N/A ,N/A,Football -- Poll bowls -- Golf -- Majors -- Baseball -- Basketball -- Tennis -- Other games -- The real world -- Sports movies -- Travel -- Literature.,Sports.;Football.;Golf.;Football.;Football.;Golf.;Sports.
"Jones, Rebecca,",Oral history.,N/A ,Archive Reference: OH.3516.,N/A,"World War, 1939-1945"
"Jozsa, Frank P.,",The National Basketball Association :,"business, organization and strategy /",N/A,Introduction -- League expansions and mergers -- Team territories and relocations -- Franchise organizations and operations -- Basketball arenas and markets -- NBA domestic and foreign affairs.,Basketball;Basketball;BUSINESS & ECONOMICS;Basketball;Management.;Social Sciences.;Recreation & Sports.
"Kaminsky, Jeff D.",Critical game time periods in relation to team success in college basketball /,N/A ,Typescript.,N/A,Basketball;College sports;Success.;Basket-ball;Sports universitaires;Succ{grave}es.;Basketball;College sports;Success.
"Kase, Matthew,",The National Collegiate Athletic Association :,is 'one and done' both legal and moral? /,"Originally Published In Kase, M., Nolan, C., & O'Rourke, J. S. (2019). The National Collegiate Athletic Association: Is 'One and Done' Both Legal and Moral?. 19-13. Notre Dame, IN: The Eugene D. Fanning Center for Business Communication, Mendoza College of Business, University of Notre Dame.",N/A,Basketball players;Basketball players
"Keillor, Garrison.",We are still married :,stories & letters /,N/A,"1. Pieces. End of the trail -- Three new twins join club in spring -- Your book saved my life, Mister -- Who we were and what we meant by it -- The current crisis in remorse -- The people vs Jim -- The young Lutheran's guide to the orchestra -- Maybe you can, too -- A little help -- A liberal reaches for her whip -- Hollywood in the fifties -- Lifestyle -- He didn't go to Canada -- 2. The lake. Letters from Jack -- Three marriages. Mrs. Roy Tollerud to Mr. and Mrs. Floyd C. Olson. Mrs Ruth Luger to Mrs. Joanne Lienenkranz. Clarence Bunsen to his wife, Arlene -- The babe -- How I came to give the Memorial Day address at the Lake Wobegon Cemetery this year -- Who do you think you are? -- 3. Letters. How to write a letter -- Estate -- O the porch -- Traveler -- Sneezes -- Pool table -- Cold -- Puck drop -- Lutheran pie -- Sexy -- Regrets -- The Pennsylvania Dept. of Agr. -- Family honeymoon -- Home team -- Basketball -- Woodlawn -- Episcopal -- Nu er der jul igen -- Glad bags -- Hoppers -- Mills -- Atlanta Airport -- The talk of the town squad -- Subway -- Gettysburg -- Postcards -- Nineteen -- Patmos -- Reagan -- Laying on our backs looking up at the stars -- The meaning of life -- Stinson Beach -- 4. House poems. O what a luxury -- Lamour -- In memory of our cat, Ralph -- The solo sock -- Mrs. Sullivan -- Guilt & shame -- Obedience -- Upon becoming a doctor -- The old shower stall -- Mother's poem -- The Finn who would not take a sauna -- 5. Stories. Meeting famous people -- The lover of invention -- Lonely boy -- What did we do wrong? -- Yon -- The art of self-defense -- End of an era -- Glasnost -- After a fall -- My life in prison -- We are still married.","Humorous stories, American.;Humorous stories, American."
"Kenney, David Ngaruri.",Asylum Denied :,a Refugees Struggle for Safety in America.,N/A,Contents; Introduction; The Farmers' Boycott; Basketball; Temporary Safety; Bernie and Dave; My Day in Court; Winning the Lottery; The Fourth Circuit; A Cold Day in Richmond; Exiled; The Witch Arrives; The Lawyer's Epilogue; The Client's Epilogue; Acknowledgments; Notes; Index.,Immigrants;Political refugees;Civil rights;Human rights;Political refugees;Civil rights.;Human rights.;Immigrants;Political refugees.;Political refugees
"Kimball, Grayson T.",Differences in cohesion among starters and non-starters of recreational basketball teams /,N/A ,N/A,N/A,Teamwork (Sports);Basketball;Basketball players;Basketball players;Basketball;Teamwork (Sports)
